{
  "schemaVersion": 1,
  "package": "@vueform/ui",
  "version": "2.0.0-0.7",
  "items": [
    {
      "name": "VfAddon",
      "type": "component",
      "description": "VfAddon component"
    },
    {
      "name": "VfButton",
      "type": "component",
      "description": "VfButton component",
      "element": true
    },
    {
      "name": "VfCheckbox",
      "type": "component",
      "description": "VfCheckbox component",
      "element": true
    },
    {
      "name": "VfCheckboxes",
      "type": "component",
      "description": "VfCheckboxes component",
      "element": true
    },
    {
      "name": "VfCol",
      "type": "component",
      "description": "VfCol component"
    },
    {
      "name": "VfContent",
      "type": "component",
      "description": "VfContent component",
      "element": true
    },
    {
      "name": "VfElements",
      "type": "component",
      "description": "VfElements component"
    },
    {
      "name": "VfField",
      "type": "component",
      "description": "VfField component",
      "element": true
    },
    {
      "name": "VfFile",
      "type": "component",
      "description": "VfFile component",
      "element": true
    },
    {
      "name": "VfForm",
      "type": "component",
      "description": "VfForm component"
    },
    {
      "name": "VfGrid",
      "type": "component",
      "description": "VfGrid component",
      "element": true
    },
    {
      "name": "VfGroup",
      "type": "component",
      "description": "VfGroup component",
      "element": true
    },
    {
      "name": "VfHidden",
      "type": "component",
      "description": "VfHidden component",
      "element": true
    },
    {
      "name": "VfIcon",
      "type": "component",
      "description": "VfIcon component"
    },
    {
      "name": "VfLanguages",
      "type": "component",
      "description": "VfLanguages component"
    },
    {
      "name": "VfLayout",
      "type": "component",
      "description": "VfLayout component"
    },
    {
      "name": "VfList",
      "type": "component",
      "description": "VfList component",
      "element": true
    },
    {
      "name": "VfMatrix",
      "type": "component",
      "description": "VfMatrix component",
      "element": true
    },
    {
      "name": "VfNav",
      "type": "component",
      "description": "VfNav component"
    },
    {
      "name": "VfRadio",
      "type": "component",
      "description": "VfRadio component",
      "element": true
    },
    {
      "name": "VfRadios",
      "type": "component",
      "description": "VfRadios component",
      "element": true
    },
    {
      "name": "VfRow",
      "type": "component",
      "description": "VfRow component"
    },
    {
      "name": "VfSelect",
      "type": "component",
      "description": "VfSelect component",
      "element": true
    },
    {
      "name": "VfSteps",
      "type": "component",
      "description": "VfSteps component"
    },
    {
      "name": "VfTabs",
      "type": "component",
      "description": "VfTabs component"
    },
    {
      "name": "VfText",
      "type": "component",
      "description": "VfText component",
      "element": true
    },
    {
      "name": "VfTextarea",
      "type": "component",
      "description": "VfTextarea component",
      "element": true
    }
  ]
}
