{
  "schemaVersion": 1,
  "package": "@vueform/primevue",
  "version": "2.0.0-0.7",
  "items": [
    {
      "name": "VfAddon",
      "type": "component",
      "description": "VfAddon component"
    },
    {
      "name": "VfAutoComplete",
      "type": "component",
      "description": "VfAutoComplete component",
      "element": true
    },
    {
      "name": "VfButton",
      "type": "component",
      "description": "VfButton component",
      "element": true
    },
    {
      "name": "VfCascadeSelect",
      "type": "component",
      "description": "VfCascadeSelect component",
      "element": true
    },
    {
      "name": "VfCheckbox",
      "type": "component",
      "description": "VfCheckbox component",
      "element": true
    },
    {
      "name": "VfCheckboxGroup",
      "type": "component",
      "description": "VfCheckboxGroup component",
      "element": true
    },
    {
      "name": "VfCol",
      "type": "component",
      "description": "VfCol component"
    },
    {
      "name": "VfColorPicker",
      "type": "component",
      "description": "VfColorPicker component",
      "element": true
    },
    {
      "name": "VfContent",
      "type": "component",
      "description": "VfContent component",
      "element": true
    },
    {
      "name": "VfDatePicker",
      "type": "component",
      "description": "VfDatePicker component",
      "element": true
    },
    {
      "name": "VfEditor",
      "type": "component",
      "description": "VfEditor component",
      "element": true
    },
    {
      "name": "VfElements",
      "type": "component",
      "description": "VfElements component"
    },
    {
      "name": "VfField",
      "type": "component",
      "description": "VfField component",
      "element": true
    },
    {
      "name": "VfFileUpload",
      "type": "component",
      "description": "VfFileUpload component",
      "element": true
    },
    {
      "name": "VfForm",
      "type": "component",
      "description": "VfForm component"
    },
    {
      "name": "VfGrid",
      "type": "component",
      "description": "VfGrid component",
      "element": true
    },
    {
      "name": "VfGroup",
      "type": "component",
      "description": "VfGroup component",
      "element": true
    },
    {
      "name": "VfHidden",
      "type": "component",
      "description": "VfHidden component",
      "element": true
    },
    {
      "name": "VfInputMask",
      "type": "component",
      "description": "VfInputMask component",
      "element": true
    },
    {
      "name": "VfInputNumber",
      "type": "component",
      "description": "VfInputNumber component",
      "element": true
    },
    {
      "name": "VfInputOtp",
      "type": "component",
      "description": "VfInputOtp component",
      "element": true
    },
    {
      "name": "VfInputText",
      "type": "component",
      "description": "VfInputText component",
      "element": true
    },
    {
      "name": "VfKnob",
      "type": "component",
      "description": "VfKnob component",
      "element": true
    },
    {
      "name": "VfLayout",
      "type": "component",
      "description": "VfLayout component"
    },
    {
      "name": "VfList",
      "type": "component",
      "description": "VfList component",
      "element": true
    },
    {
      "name": "VfListbox",
      "type": "component",
      "description": "VfListbox component",
      "element": true
    },
    {
      "name": "VfMatrix",
      "type": "component",
      "description": "VfMatrix component",
      "element": true
    },
    {
      "name": "VfMultiSelect",
      "type": "component",
      "description": "VfMultiSelect component",
      "element": true
    },
    {
      "name": "VfNav",
      "type": "component",
      "description": "VfNav component"
    },
    {
      "name": "VfPassword",
      "type": "component",
      "description": "VfPassword component",
      "element": true
    },
    {
      "name": "VfRadioButton",
      "type": "component",
      "description": "VfRadioButton component",
      "element": true
    },
    {
      "name": "VfRadioButtonGroup",
      "type": "component",
      "description": "VfRadioButtonGroup component",
      "element": true
    },
    {
      "name": "VfRating",
      "type": "component",
      "description": "VfRating component",
      "element": true
    },
    {
      "name": "VfRow",
      "type": "component",
      "description": "VfRow component"
    },
    {
      "name": "VfSelect",
      "type": "component",
      "description": "VfSelect component",
      "element": true
    },
    {
      "name": "VfSelectButton",
      "type": "component",
      "description": "VfSelectButton component",
      "element": true
    },
    {
      "name": "VfSlider",
      "type": "component",
      "description": "VfSlider component",
      "element": true
    },
    {
      "name": "VfTextarea",
      "type": "component",
      "description": "VfTextarea component",
      "element": true
    },
    {
      "name": "VfToggleButton",
      "type": "component",
      "description": "VfToggleButton component",
      "element": true
    },
    {
      "name": "VfToggleSwitch",
      "type": "component",
      "description": "VfToggleSwitch component",
      "element": true
    },
    {
      "name": "VfTreeSelect",
      "type": "component",
      "description": "VfTreeSelect component",
      "element": true
    }
  ]
}
