{
  "schemaVersion": 1,
  "package": "@vueform/ui",
  "version": "2.0.0",
  "items": [
    {
      "name": "VfAddon",
      "type": "component",
      "description": "Input addon for prefix and suffix content"
    },
    {
      "name": "VfButton",
      "type": "component",
      "description": "Button element",
      "element": true
    },
    {
      "name": "VfCheckbox",
      "type": "component",
      "description": "Single checkbox element",
      "element": true
    },
    {
      "name": "VfCheckboxes",
      "type": "component",
      "description": "Checkbox group element",
      "element": true
    },
    {
      "name": "VfCol",
      "type": "component",
      "description": "Grid column layout component"
    },
    {
      "name": "VfContent",
      "type": "component",
      "description": "Static content element",
      "element": true
    },
    {
      "name": "VfElements",
      "type": "component",
      "description": "Renders a schema's elements"
    },
    {
      "name": "VfField",
      "type": "component",
      "description": "Base element for building custom fields",
      "element": true
    },
    {
      "name": "VfFile",
      "type": "component",
      "description": "File upload element",
      "element": true
    },
    {
      "name": "VfForm",
      "type": "component",
      "description": "Form root component"
    },
    {
      "name": "VfGrid",
      "type": "component",
      "description": "Grid layout component",
      "element": true
    },
    {
      "name": "VfGroup",
      "type": "component",
      "description": "Group element for structuring schema",
      "element": true
    },
    {
      "name": "VfHidden",
      "type": "component",
      "description": "Hidden input element",
      "element": true
    },
    {
      "name": "VfIcon",
      "type": "component",
      "description": "Icon component"
    },
    {
      "name": "VfLanguages",
      "type": "component",
      "description": "Language switcher for multilingual forms"
    },
    {
      "name": "VfLayout",
      "type": "component",
      "description": "Element layout with label, description, and errors"
    },
    {
      "name": "VfList",
      "type": "component",
      "description": "Repeatable list element",
      "element": true
    },
    {
      "name": "VfMatrix",
      "type": "component",
      "description": "Matrix element of rows and columns",
      "element": true
    },
    {
      "name": "VfNav",
      "type": "component",
      "description": "Form navigation controls"
    },
    {
      "name": "VfRadio",
      "type": "component",
      "description": "Single radio element",
      "element": true
    },
    {
      "name": "VfRadios",
      "type": "component",
      "description": "Radio group element",
      "element": true
    },
    {
      "name": "VfRow",
      "type": "component",
      "description": "Grid row layout component"
    },
    {
      "name": "VfSelect",
      "type": "component",
      "description": "Select element",
      "element": true
    },
    {
      "name": "VfSteps",
      "type": "component",
      "description": "Step-based form navigation"
    },
    {
      "name": "VfTabs",
      "type": "component",
      "description": "Tabbed form navigation"
    },
    {
      "name": "VfText",
      "type": "component",
      "description": "Text input element",
      "element": true
    },
    {
      "name": "VfTextarea",
      "type": "component",
      "description": "Multiline text input element",
      "element": true
    }
  ]
}
